{
  "date": "2026-07-30",
  "timezone": "Asia/Shanghai",
  "generatedAt": "2026-07-30T08:00:00+08:00",
  "today": {
    "focus": {
      "id": "today-ai-commerce",
      "page": "today",
      "source": "today",
      "category": "AI",
      "subCategory": "E-commerce operations",
      "contentType": "Focus",
      "title": "AI 内容工具正在从效率工具变成货架基础设施",
      "summary": "越来越多小品牌把 AI 用在商品图、标题测试、详情页说明和评论 FAQ 上。真正拉开差距的不是生成速度，而是品牌判断、证据路径和内容边界能否一起被系统化。",
      "what": "AI 生成正在进入日常运营，而不是只作为一次性营销活动。",
      "why": "当内容生产成本下降，用户更需要判断哪些信息可信、哪些只是包装。",
      "takeaway": "观察 AI 工具时，不只看它能生成什么，也看它如何保留来源、边界和人工判断。",
      "aiNote": "今天先用一个重点进入，再用 Daily Brief 建立观察方向。",
      "tags": [
        "AI",
        "E-commerce",
        "content system"
      ],
      "sourceName": "",
      "sourceUrl": "",
      "sourceType": "editorial observation",
      "visualImportance": 0,
      "relatedTags": [
        "AI",
        "E-commerce"
      ],
      "relatedContentIds": [
        "obs-ai-product",
        "obs-ecom-product-page"
      ]
    },
    "brief": {
      "forYou": [
        {
          "id": "brief-producer-tag",
          "relatedObserveId": "obs-khh-music",
          "category": "K-Hiphop",
          "readTime": "2 min",
          "title": "Producer tag 正在成为短视频里的声音 Logo",
          "summary": "音色、producer tag 和第一句歌词，正在比副歌更早建立听众记忆。短视频传播让歌曲身份前移到前两秒。"
        },
        {
          "id": "brief-xhs-search",
          "relatedObserveId": "obs-self-xhs-search",
          "category": "Self-media",
          "readTime": "3 min",
          "title": "小红书笔记越来越像可保存的搜索答案",
          "summary": "高表现笔记会先回答具体问题，再用对比、经验和案例建立作者风格。搜索流量提高后，清晰答案更容易长尾曝光。"
        },
        {
          "id": "brief-ai-source",
          "relatedObserveId": "obs-ai-product",
          "category": "AI",
          "readTime": "3 min",
          "title": "AI 产品需要把来源路径做成界面能力",
          "summary": "用户不只想看结论，还想知道哪些内容有依据、哪些是推断。来源路径会成为 AI 工具的信任基础。"
        }
      ],
      "trending": [
        {
          "id": "brief-packaging",
          "relatedObserveId": "obs-design-packaging",
          "category": "Design",
          "readTime": "2 min",
          "title": "包装设计的信任感来自信息顺序",
          "summary": "品牌、品类、核心利益和证明的阅读顺序，会直接影响用户是否觉得产品可靠。包装不是装饰，而是决策界面。"
        },
        {
          "id": "brief-commerce-trust",
          "relatedObserveId": "obs-ecom-trust",
          "category": "E-commerce",
          "readTime": "3 min",
          "title": "电商信任线索正在从评论扩展到细节系统",
          "summary": "尺码、退换、成分、对比图和使用边界共同降低购买风险。真正阻碍转化的常常是未回答的小疑问。"
        }
      ]
    },
    "continueLearning": [
      "en-shaping-idea",
      "ko-kind-of",
      "obs-ai-product"
    ]
  },
  "observe": [
    {
      "id": "obs-self-xhs-search",
      "page": "observe",
      "source": "observe",
      "category": "Self-media",
      "subCategory": "Xiaohongshu",
      "contentType": "breakdown",
      "readingTime": "1 min",
      "title": "小红书笔记越来越像可保存的搜索答案",
      "summary": "越来越多高表现笔记会先明确回答一个具体问题，再通过案例、对比和个人经验建立作者风格。",
      "what": "平台搜索流量提高后，笔记不再只服务即时种草，也在服务长期检索。一个强笔记通常先给出清晰问题，再用步骤、对比图或经验判断降低理解成本。",
      "why": "这改变了自媒体写作的重心：标题不只是吸引点击，正文也要像答案页一样可复用。越能持续解决具体问题，越容易获得长尾收藏和二次搜索曝光。",
      "takeaway": "写笔记时先问：用户保存这条内容，是为了以后解决哪一个问题？如果答案不清楚，就先收窄问题。",
      "tags": [
        "Self-media",
        "Xiaohongshu",
        "search"
      ],
      "sourceName": "",
      "sourceUrl": "",
      "sourceType": "editorial observation",
      "visualImportance": 0,
      "mechanism": "搜索型内容的机制是问题明确、证据可见、经验可信。作者风格不会消失，而是出现在筛选标准和判断过程里。"
    },
    {
      "id": "obs-self-instagram-carousel",
      "page": "observe",
      "source": "observe",
      "category": "Self-media",
      "subCategory": "Instagram",
      "contentType": "gallery",
      "readingTime": "1 min",
      "title": "Instagram carousel 正在变成迷你编辑稿",
      "summary": "轮播不只是多图展示，而是把一个观点拆成多个可滑动段落。",
      "what": "很多创作者把 carousel 当作轻量文章：第一页建立问题，后面用分镜展示论点、证据、例子和结论。用户每一次滑动都像继续读下一段。",
      "why": "复杂观点不必依赖很长 caption，也能在信息流里完成解释。对创作者来说，保存率往往来自结构，而不是单张视觉图的漂亮程度。",
      "takeaway": "规划 carousel 时，不要先想放几张图，先写出每一页承担的功能。",
      "tags": [
        "Self-media",
        "Instagram",
        "carousel"
      ],
      "sourceName": "Wikimedia Commons",
      "sourceUrl": "https://commons.wikimedia.org/wiki/File:Instagram_app_on_smartphone.jpg",
      "sourceType": "image reference",
      "visualImportance": 1,
      "practicalObservation": "如果第三页以后没有新信息，用户会感到被拖长；如果每页都有微小推进，轮播会像一篇短编辑稿。",
      "imageUrl": "https://commons.wikimedia.org/wiki/Special:Redirect/file/Instagram_app_on_smartphone.jpg?width=960",
      "imageAlt": "Instagram app displayed on a smartphone, showing feed-based visual reading behavior.",
      "imageCredit": "Santeri Viinamaki, CC BY-SA 4.0, via Wikimedia Commons",
      "imageSourceUrl": "https://commons.wikimedia.org/wiki/File:Instagram_app_on_smartphone.jpg"
    },
    {
      "id": "obs-self-youtube-retention",
      "page": "observe",
      "source": "observe",
      "category": "Self-media",
      "subCategory": "YouTube",
      "contentType": "comparison",
      "readingTime": "1 min",
      "title": "YouTube 开场正在从寒暄变成观看契约",
      "summary": "更有效的开场会快速说明看完视频能理解什么、避免什么误区、得到什么判断。",
      "what": "过去许多视频用问候、背景和自我介绍开场；现在更强的开场会直接给出观看收益，例如告诉观众看完会解决哪个具体判断。",
      "why": "用户在前十几秒判断视频是否值得继续。清晰的学习契约能降低离开成本，也让创作者的个性建立在有效信息之后。",
      "takeaway": "把开场从“我是谁”改成“你会得到什么”。个性不是不要，而是放在承诺之后。",
      "tags": [
        "Self-media",
        "YouTube",
        "retention"
      ],
      "sourceName": "",
      "sourceUrl": "",
      "sourceType": "editorial observation",
      "visualImportance": 0,
      "comparison": "A：大家好，今天聊聊我的拍摄经验。B：如果你总觉得照片不高级，先看这三个构图错误。B 更像契约。"
    },
    {
      "id": "obs-self-content-pillars",
      "page": "observe",
      "source": "observe",
      "category": "Self-media",
      "subCategory": "Content strategy",
      "contentType": "breakdown",
      "readingTime": "1 min",
      "title": "内容支柱应该像视角，而不是固定栏目",
      "summary": "僵硬的内容支柱会让账号重复；好的内容视角能让同一主题服务不同用户任务。",
      "what": "很多账号把支柱理解成固定栏目，例如教程、生活、产品。更有效的做法是按用户任务组织：学习、比较、决定、应用、收藏。",
      "why": "用户不是为了栏目而来，而是为了完成一个理解动作。用任务定义内容，既能保持账号一致性，也能避免每条内容像换皮模板。",
      "takeaway": "为每个主题写五个视角：怎么入门、如何比较、何时购买、怎样应用、值得收藏什么。",
      "tags": [
        "Self-media",
        "strategy",
        "creator"
      ],
      "sourceName": "",
      "sourceUrl": "",
      "sourceType": "editorial observation",
      "visualImportance": 0,
      "mechanism": "视角型支柱把创作者的判断变成可复用框架。用户记住的不是栏目名，而是你总能帮他们更快看懂问题。"
    },
    {
      "id": "obs-self-creator-business",
      "page": "observe",
      "source": "observe",
      "category": "Self-media",
      "subCategory": "Creator business",
      "contentType": "case-study",
      "readingTime": "1 min",
      "title": "创作者产品需要先解释使用场景，再进入销售",
      "summary": "模板、课程和指南类产品不是越快展示价格越好，用户需要先判断它是不是为当前问题准备的。",
      "what": "表现更好的创作者产品页，往往像短文章：先定义问题，再说明适合谁、不适合谁、如何使用，最后才是购买动作。",
      "why": "数字产品没有实体触感，信任来自场景解释。用户越能想象自己如何使用，就越容易理解价值。",
      "takeaway": "销售前先回答四件事：谁适合、解决什么、怎么用、边界在哪里。讲清楚边界反而会增加信任。",
      "tags": [
        "Self-media",
        "creator business",
        "digital product"
      ],
      "sourceName": "",
      "sourceUrl": "",
      "sourceType": "editorial observation",
      "visualImportance": 0,
      "example": "一个 Notion 模板如果只说提升效率会显得空；如果说明适合每周做内容复盘的独立创作者，用户更容易判断是否购买。"
    },
    {
      "id": "obs-design-packaging",
      "page": "observe",
      "source": "observe",
      "category": "Design",
      "subCategory": "Packaging",
      "contentType": "case-study",
      "readingTime": "1 min",
      "title": "包装信任来自信息层级，而不是更满的视觉",
      "summary": "好的包装让用户不用导读，就能看见品牌、品类、核心利益和证明。",
      "what": "包装像一个小型决策界面。用户通常先看品牌和品类，再看功效、规格、成分或使用场景。如果这些顺序混乱，产品会显得不可靠。",
      "why": "货架和电商缩略图都在压缩阅读时间。清晰层级能让用户快速判断这是什么、适不适合我、为什么可信。",
      "takeaway": "分析包装时先列阅读路径，而不是先评价好不好看：第一眼读到什么，第二眼确认什么，第三眼获得什么证明。",
      "tags": [
        "Design",
        "packaging",
        "trust"
      ],
      "sourceName": "Wikimedia Commons",
      "sourceUrl": "https://commons.wikimedia.org/wiki/File:Box_of_Korean_cosmetics.jpg",
      "sourceType": "image reference",
      "visualImportance": 2,
      "example": "低饱和色不自动等于高级。真正让包装安静的是层级清晰、留白合理、信息不互相抢夺。",
      "imageUrl": "https://commons.wikimedia.org/wiki/Special:Redirect/file/Box_of_Korean_cosmetics.jpg?width=960",
      "imageAlt": "Korean cosmetics packaging arranged in a green product box.",
      "imageCredit": "Teemeah, CC BY-SA 3.0, via Wikimedia Commons",
      "imageSourceUrl": "https://commons.wikimedia.org/wiki/File:Box_of_Korean_cosmetics.jpg"
    },
    {
      "id": "obs-design-typography",
      "page": "observe",
      "source": "observe",
      "category": "Design",
      "subCategory": "Typography",
      "contentType": "gallery",
      "readingTime": "1 min",
      "title": "韩文字体的文化感来自组合、间距和节奏",
      "summary": "韩文字体不只是字形选择，它能通过字块密度、留白和排列方式传递现代、怀旧、街头或高级感。",
      "what": "同样的韩文词，在紧密组合、宽松排列、粗笔画或细笔画中会呈现不同语气。很多品牌视觉会用字体先建立文化氛围，再用颜色补充情绪。",
      "why": "对中文使用者来说，韩文字体常被看成异域装饰。但真正的设计判断在于字形如何组织阅读节奏。",
      "takeaway": "看韩文视觉时，不要只问字体名。观察字距、行距、字块大小和它与图片的关系。",
      "tags": [
        "Design",
        "typography",
        "Korea"
      ],
      "sourceName": "Wikimedia Commons",
      "sourceUrl": "https://commons.wikimedia.org/wiki/File:3_Korean_Samples.png",
      "sourceType": "image reference",
      "visualImportance": 2,
      "practicalObservation": "Hangeul 的方块结构让排版本身具有节奏感，因此适合在封面、包装和海报中承担强识别角色。",
      "imageUrl": "https://commons.wikimedia.org/wiki/Special:Redirect/file/3%20Korean%20Samples.png?width=960",
      "imageAlt": "Three samples of Korean typography showing different Hangul letterform treatments.",
      "imageCredit": "Wikimedia Commons contributors, via Wikimedia Commons",
      "imageSourceUrl": "https://commons.wikimedia.org/wiki/File:3_Korean_Samples.png"
    },
    {
      "id": "obs-design-branding",
      "page": "observe",
      "source": "observe",
      "category": "Design",
      "subCategory": "Branding",
      "contentType": "observation",
      "readingTime": "45 sec",